{
  "project": "InfluencerAI_Avatar01",
  "version": "v1.0.0",
  "updated_at": "2025-09-27T07:20:41",
  "items": [
    {
      "file": "2025-09-27_varA_master004_pose-frontal_halfbody_light-goldenhour_crop-half_context-cafe_minimal_outfit-white_blouse_expr-neutral.png",
      "source_master": "2025-09-27_master_004.png",
      "labels": {
        "pose": "frontal_halfbody",
        "light": "goldenhour",
        "crop": "half",
        "context": "cafe_minimal",
        "outfit": "white_blouse",
        "expression": "neutral",
        "lens": "50mm",
        "angle": "eye_level_3by4",
        "season": "summer_warm"
      },
      "split": "train",
      "qc": {
        "face_sim": 0.92,
        "phash": "a1b2c3d4e5",
        "nsfw": false
      },
      "tags": [
        "pose:frontal_halfbody",
        "light:goldenhour",
        "editorial"
      ]
    }
  ]
}